{
  "id": "be16bad7-2a30-4f1c-bee5-f653ded15627",
  "holdId": "7babb1ab-f46f-4c74-8950-bda779440f6f",
  "itemBarcode": "326585216743",
  "instanceTitle": "Title sample",
  "instanceAuthor": "Matt Gordon",
  "callNumber": "1234567890",
  "patronBarcode": "543285216734",
  "patronName": "John Smith",
  "retrievedDateTime": "2021-02-19T17:29:38.524736500",
  "pickupLocation": "KU/CC/DI",
  "requestStatus": "Open - Not yet filled",
  "requestNote": "request note sample",
  "createdDateTime": "2021-02-19T17:27:38.524736500",
  "remoteStorageId": "d3cfdb9e-e364-4209-85e5-8f49fc0969b5"
}
